{
  "schemaVersion": 1,
  "generatedAt": "2026-04-17T14:54:37+00:00",
  "clipFps": 10,
  "clipDurationSec": 3,
  "distribution": {
    "easy": 9,
    "medium": 12,
    "hard": 6,
    "gotcha": 3
  },
  "pool": [
    {
      "id": "pair_0000",
      "tier": "easy",
      "glitchFamily": "teleport",
      "clipA": {
        "src": "/clips/pair_0000_a.mp4",
        "isGlitched": true,
        "surpriseScore": [
          0.42685580253601074,
          0.008556477725505829,
          0.004443644545972347,
          0.005363932345062494,
          0.0033378403168171644
        ]
      },
      "clipB": {
        "src": "/clips/pair_0000_b.mp4",
        "isGlitched": false,
        "surpriseScore": [
          0.014456361532211304,
          0.0517902635037899,
          0.07046037167310715,
          0.10231252759695053,
          0.016637826338410378
        ]
      }
    },
    {
      "id": "pair_0001",
      "tier": "easy",
      "glitchFamily": "teleport",
      "clipA": {
        "src": "/clips/pair_0001_a.mp4",
        "isGlitched": false,
        "surpriseScore": [
          0.11880511045455933,
          0.012952330522239208,
          0.018693603575229645,
          0.39284706115722656,
          0.0071867466904222965
        ]
      },
      "clipB": {
        "src": "/clips/pair_0001_b.mp4",
        "isGlitched": true,
        "surpriseScore": [
          0.008420021273195744,
          0.02771429717540741,
          0.9529368281364441,
          0.054036695510149,
          0.0317266620695591
        ]
      }
    },
    {
      "id": "pair_0002",
      "tier": "easy",
      "glitchFamily": "teleport",
      "clipA": {
        "src": "/clips/pair_0002_a.mp4",
        "isGlitched": true,
        "surpriseScore": [
          0.03504330292344093,
          1.3872853517532349,
          0.037483081221580505,
          0.011761069297790527,
          0.03468761593103409
        ]
      },
      "clipB": {
        "src": "/clips/pair_0002_b.mp4",
        "isGlitched": false,
        "surpriseScore": [
          0.017529809847474098,
          0.12529315054416656,
          0.0043922304175794125,
          0.0034201936796307564,
          0.004011021461337805
        ]
      }
    },
    {
      "id": "pair_0003",
      "tier": "easy",
      "glitchFamily": "teleport",
      "clipA": {
        "src": "/clips/pair_0003_a.mp4",
        "isGlitched": false,
        "surpriseScore": [
          0.01636059582233429,
          0.033219024538993835,
          0.06773269921541214,
          0.04661659523844719,
          0.025651782751083374
        ]
      },
      "clipB": {
        "src": "/clips/pair_0003_b.mp4",
        "isGlitched": true,
        "surpriseScore": [
          0.03547953441739082,
          0.05508660152554512,
          2.0282933712005615,
          0.0066957673989236355,
          0.04284713789820671
        ]
      }
    },
    {
      "id": "pair_0004",
      "tier": "easy",
      "glitchFamily": "teleport",
      "clipA": {
        "src": "/clips/pair_0004_a.mp4",
        "isGlitched": true,
        "surpriseScore": [
          0.06437567621469498,
          0.07678105682134628,
          0.2993461489677429,
          0.010315144434571266,
          1.4449008703231812
        ]
      },
      "clipB": {
        "src": "/clips/pair_0004_b.mp4",
        "isGlitched": false,
        "surpriseScore": [
          0.012740624137222767,
          0.01817653886973858,
          0.012292437255382538,
          0.007962964475154877,
          0.005658464971929789
        ]
      }
    },
    {
      "id": "pair_0005",
      "tier": "easy",
      "glitchFamily": "teleport",
      "clipA": {
        "src": "/clips/pair_0005_a.mp4",
        "isGlitched": false,
        "surpriseScore": [
          0.11608541011810303,
          0.00999459158629179,
          0.01043266337364912,
          0.02332638017833233,
          0.0029094212222844362
        ]
      },
      "clipB": {
        "src": "/clips/pair_0005_b.mp4",
        "isGlitched": true,
        "surpriseScore": [
          0.015845365822315216,
          0.004829337354749441,
          0.017170188948512077,
          0.00549751752987504,
          0.26393064856529236
        ]
      }
    },
    {
      "id": "pair_0006",
      "tier": "easy",
      "glitchFamily": "teleport",
      "clipA": {
        "src": "/clips/pair_0006_a.mp4",
        "isGlitched": false,
        "surpriseScore": [
          0.06437567621469498,
          0.07678105682134628,
          0.2993461489677429,
          0.010315144434571266,
          0.010309893637895584
        ]
      },
      "clipB": {
        "src": "/clips/pair_0006_b.mp4",
        "isGlitched": true,
        "surpriseScore": [
          0.015550017356872559,
          0.5677542686462402,
          0.004752230364829302,
          0.0033049460034817457,
          0.0035184386651962996
        ]
      }
    },
    {
      "id": "pair_0007",
      "tier": "easy",
      "glitchFamily": "teleport",
      "clipA": {
        "src": "/clips/pair_0007_a.mp4",
        "isGlitched": false,
        "surpriseScore": [
          0.05969320610165596,
          0.010145631618797779,
          0.09032627195119858,
          0.01561258640140295,
          0.006060022860765457
        ]
      },
      "clipB": {
        "src": "/clips/pair_0007_b.mp4",
        "isGlitched": true,
        "surpriseScore": [
          0.03625128045678139,
          0.0716392919421196,
          0.0375300832092762,
          0.02457362227141857,
          1.9245281219482422
        ]
      }
    },
    {
      "id": "pair_0008",
      "tier": "easy",
      "glitchFamily": "teleport",
      "clipA": {
        "src": "/clips/pair_0008_a.mp4",
        "isGlitched": true,
        "surpriseScore": [
          0.44291138648986816,
          0.024846062064170837,
          0.015936145558953285,
          1.879611611366272,
          0.1175159141421318
        ]
      },
      "clipB": {
        "src": "/clips/pair_0008_b.mp4",
        "isGlitched": false,
        "surpriseScore": [
          0.024465546011924744,
          0.0073554906994104385,
          0.009917734190821648,
          0.03695286810398102,
          0.011687892489135265
        ]
      }
    },
    {
      "id": "pair_0009",
      "tier": "medium",
      "glitchFamily": "teleport",
      "clipA": {
        "src": "/clips/pair_0009_a.mp4",
        "isGlitched": true,
        "surpriseScore": [
          0.18441136181354523,
          0.2599298059940338,
          0.12713927030563354,
          1.3001629114151,
          1.5017967224121094
        ]
      },
      "clipB": {
        "src": "/clips/pair_0009_b.mp4",
        "isGlitched": false,
        "surpriseScore": [
          0.06434131413698196,
          0.021208012476563454,
          0.02037195861339569,
          0.01757708564400673,
          0.007024172693490982
        ]
      }
    },
    {
      "id": "pair_0010",
      "tier": "medium",
      "glitchFamily": "teleport",
      "clipA": {
        "src": "/clips/pair_0010_a.mp4",
        "isGlitched": true,
        "surpriseScore": [
          0.02222158946096897,
          0.06195644661784172,
          0.27619609236717224,
          0.04058750718832016,
          0.00507644098252058
        ]
      },
      "clipB": {
        "src": "/clips/pair_0010_b.mp4",
        "isGlitched": false,
        "surpriseScore": [
          0.02162724733352661,
          0.008455861359834671,
          0.013749857433140278,
          0.08654168993234634,
          0.04095763340592384
        ]
      }
    },
    {
      "id": "pair_0011",
      "tier": "medium",
      "glitchFamily": "time-reversal",
      "clipA": {
        "src": "/clips/pair_0011_a.mp4",
        "isGlitched": true,
        "surpriseScore": [
          0.10516807436943054,
          0.037802521139383316,
          0.18068712949752808,
          0.003922155126929283,
          0.003662626026198268
        ]
      },
      "clipB": {
        "src": "/clips/pair_0011_b.mp4",
        "isGlitched": false,
        "surpriseScore": [
          0.06484092026948929,
          0.018745984882116318,
          0.02832886017858982,
          0.02866148203611374,
          0.02079719491302967
        ]
      }
    },
    {
      "id": "pair_0012",
      "tier": "medium",
      "glitchFamily": "time-reversal",
      "clipA": {
        "src": "/clips/pair_0012_a.mp4",
        "isGlitched": true,
        "surpriseScore": [
          0.05969320610165596,
          0.010145631618797779,
          0.09032627195119858,
          0.01561258640140295,
          0.018380628898739815
        ]
      },
      "clipB": {
        "src": "/clips/pair_0012_b.mp4",
        "isGlitched": false,
        "surpriseScore": [
          0.05097128823399544,
          0.005003361497074366,
          0.06738347560167313,
          0.008579612709581852,
          0.03862883895635605
        ]
      }
    },
    {
      "id": "pair_0013",
      "tier": "medium",
      "glitchFamily": "time-reversal",
      "clipA": {
        "src": "/clips/pair_0013_a.mp4",
        "isGlitched": true,
        "surpriseScore": [
          0.013880778104066849,
          0.03656758368015289,
          0.07182952016592026,
          0.11191602796316147,
          0.34249982237815857
        ]
      },
      "clipB": {
        "src": "/clips/pair_0013_b.mp4",
        "isGlitched": false,
        "surpriseScore": [
          0.006843697279691696,
          0.041763320565223694,
          0.21975088119506836,
          0.12964175641536713,
          0.008833535946905613
        ]
      }
    },
    {
      "id": "pair_0014",
      "tier": "medium",
      "glitchFamily": "teleport",
      "clipA": {
        "src": "/clips/pair_0014_a.mp4",
        "isGlitched": true,
        "surpriseScore": [
          0.08802857249975204,
          0.10583112388849258,
          0.11832994967699051,
          0.2188841700553894,
          0.6300166249275208
        ]
      },
      "clipB": {